tablename,indexname,indexdef
sleep_tags,idx_sleep_tags_tag_type,CREATE INDEX idx_sleep_tags_tag_type ON public.sleep_tags USING btree (tag_type)
sleep_tracking,idx_sleep_tracking_email_date,"CREATE INDEX idx_sleep_tracking_email_date ON public.sleep_tracking USING btree (email, date)"
supplement_logs_app,idx_supplement_logs_user_date,"CREATE INDEX idx_supplement_logs_user_date ON public.supplement_logs_app USING btree (user_id, log_date DESC)"
supplement_logs_app,idx_supplement_logs_user_taken,"CREATE INDEX idx_supplement_logs_user_taken ON public.supplement_logs_app USING btree (user_id, log_date) WHERE (taken = true)"
supplement_tags,idx_supplement_tags_supplement_id,CREATE INDEX idx_supplement_tags_supplement_id ON public.supplement_tags USING btree (supplement_id)
supplement_tags,idx_supplement_tags_tag_type,CREATE INDEX idx_supplement_tags_tag_type ON public.supplement_tags USING btree (tag_type)
supplements,idx_supplements_program_id,CREATE INDEX idx_supplements_program_id ON public.supplements USING btree (program_id)
supplements,idx_supplements_program_time,"CREATE INDEX idx_supplements_program_time ON public.supplements USING btree (program_id, time_of_day)"
supplements_taken,idx_supplements_taken_user_date,"CREATE INDEX idx_supplements_taken_user_date ON public.supplements_taken USING btree (user_id, date)"
target_keywords,idx_target_keywords_assigned_content,CREATE INDEX idx_target_keywords_assigned_content ON public.target_keywords USING btree (assigned_content_id) WHERE (assigned_content_id IS NOT NULL)
target_keywords,idx_target_keywords_category,CREATE INDEX idx_target_keywords_category ON public.target_keywords USING btree (category)
target_keywords,idx_target_keywords_content_status,CREATE INDEX idx_target_keywords_content_status ON public.target_keywords USING btree (content_status)
target_keywords,idx_target_keywords_focus_score,CREATE INDEX idx_target_keywords_focus_score ON public.target_keywords USING btree (focus_score DESC)
target_keywords,idx_target_keywords_priority,CREATE INDEX idx_target_keywords_priority ON public.target_keywords USING btree (priority)
target_keywords,idx_target_keywords_target_url,CREATE INDEX idx_target_keywords_target_url ON public.target_keywords USING btree (target_url)
testoup_inventory,idx_testoup_inventory_email,CREATE INDEX idx_testoup_inventory_email ON public.testoup_inventory USING btree (email)
testoup_purchase_history,idx_testoup_purchases_email,CREATE INDEX idx_testoup_purchases_email ON public.testoup_purchase_history USING btree (email)
testoup_purchase_history,idx_testoup_purchases_order_id,CREATE INDEX idx_testoup_purchases_order_id ON public.testoup_purchase_history USING btree (order_id)
testoup_tracking,idx_testoup_tracking_email_date,"CREATE INDEX idx_testoup_tracking_email_date ON public.testoup_tracking USING btree (email, date)"
user_achievements,idx_achievements_user_date,"CREATE INDEX idx_achievements_user_date ON public.user_achievements USING btree (user_id, unlocked_at DESC)"
user_achievements,idx_user_achievements_type,CREATE INDEX idx_user_achievements_type ON public.user_achievements USING btree (achievement_type)
user_achievements,idx_user_achievements_user,CREATE INDEX idx_user_achievements_user ON public.user_achievements USING btree (user_id)
user_activations,idx_activations_email,CREATE INDEX idx_activations_email ON public.user_activations USING btree (email)
user_activations,idx_activations_status,CREATE INDEX idx_activations_status ON public.user_activations USING btree (activation_status)
user_activations,idx_activations_user_id,CREATE INDEX idx_activations_user_id ON public.user_activations USING btree (user_id)
user_challenges,idx_user_challenges_completed,CREATE INDEX idx_user_challenges_completed ON public.user_challenges USING btree (is_completed)
user_challenges,idx_user_challenges_user,CREATE INDEX idx_user_challenges_user ON public.user_challenges USING btree (user_id)
user_checkins,idx_checkins_date,CREATE INDEX idx_checkins_date ON public.user_checkins USING btree (check_in_date)
user_checkins,idx_checkins_day_number,CREATE INDEX idx_checkins_day_number ON public.user_checkins USING btree (day_number)
user_checkins,idx_checkins_user_id,CREATE INDEX idx_checkins_user_id ON public.user_checkins USING btree (user_id)
user_exercise_substitutions,idx_user_exercise_substitutions_email_date,"CREATE INDEX idx_user_exercise_substitutions_email_date ON public.user_exercise_substitutions USING btree (email, date)"
user_ingredient_checklist,idx_user_ingredient_checklist_user_week,"CREATE INDEX idx_user_ingredient_checklist_user_week ON public.user_ingredient_checklist USING btree (user_id, week_start_date)"
user_meal_goals,idx_user_meal_goals_user_id,CREATE INDEX idx_user_meal_goals_user_id ON public.user_meal_goals USING btree (user_id)
user_progress,idx_user_progress_date,CREATE INDEX idx_user_progress_date ON public.user_progress USING btree (date)
user_progress,idx_user_progress_user_id,CREATE INDEX idx_user_progress_user_id ON public.user_progress USING btree (user_id)
user_progress_photos,idx_user_progress_photos_photo_date,CREATE INDEX idx_user_progress_photos_photo_date ON public.user_progress_photos USING btree (photo_date)
user_progress_photos,idx_user_progress_photos_user_date,"CREATE INDEX idx_user_progress_photos_user_date ON public.user_progress_photos USING btree (user_id, photo_date)"
user_progress_photos,idx_user_progress_photos_user_id,CREATE INDEX idx_user_progress_photos_user_id ON public.user_progress_photos USING btree (user_id)
user_quiz_results,idx_quiz_results_user_id,CREATE INDEX idx_quiz_results_user_id ON public.user_quiz_results USING btree (user_id)
user_rewards,idx_user_rewards_claimed,CREATE INDEX idx_user_rewards_claimed ON public.user_rewards USING btree (is_claimed)
user_rewards,idx_user_rewards_user,CREATE INDEX idx_user_rewards_user ON public.user_rewards USING btree (user_id)
user_score_history,idx_user_score_history_day_number,CREATE INDEX idx_user_score_history_day_number ON public.user_score_history USING btree (day_number)
user_score_history,idx_user_score_history_recorded_at,CREATE INDEX idx_user_score_history_recorded_at ON public.user_score_history USING btree (recorded_at DESC)
user_score_history,idx_user_score_history_user_id,CREATE INDEX idx_user_score_history_user_id ON public.user_score_history USING btree (user_id)
user_streaks,idx_streaks_user_type,"CREATE INDEX idx_streaks_user_type ON public.user_streaks USING btree (user_id, streak_type)"
user_streaks,idx_user_streaks_user_type,"CREATE INDEX idx_user_streaks_user_type ON public.user_streaks USING btree (user_id, streak_type)"
user_supplements_app,idx_user_supplements_enabled,"CREATE INDEX idx_user_supplements_enabled ON public.user_supplements_app USING btree (user_id, enabled) WHERE (enabled = true)"
user_supplements_app,idx_user_supplements_user_id,CREATE INDEX idx_user_supplements_user_id ON public.user_supplements_app USING btree (user_id)
users,idx_users_category_level,"CREATE INDEX idx_users_category_level ON public.users USING btree (category, current_level)"
users,idx_users_dietary_preference,CREATE INDEX idx_users_dietary_preference ON public.users USING btree (dietary_preference)
users,idx_users_email,CREATE INDEX idx_users_email ON public.users USING btree (email)
weekly_measurements_pro,idx_weekly_measurements_pro_user_date,"CREATE INDEX idx_weekly_measurements_pro_user_date ON public.weekly_measurements_pro USING btree (user_id, date DESC)"
workout_exercise_sets,idx_workout_exercise_sets_email_date,"CREATE INDEX idx_workout_exercise_sets_email_date ON public.workout_exercise_sets USING btree (email, date)"
workout_exercise_sets,idx_workout_exercise_sets_exercise,"CREATE INDEX idx_workout_exercise_sets_exercise ON public.workout_exercise_sets USING btree (email, exercise_name, date)"
workout_exercise_sets,idx_workout_exercise_sets_session,CREATE INDEX idx_workout_exercise_sets_session ON public.workout_exercise_sets USING btree (workout_session_id)
workout_exercise_sets,idx_workout_exercise_sets_workout_order,"CREATE INDEX idx_workout_exercise_sets_workout_order ON public.workout_exercise_sets USING btree (workout_session_id, exercise_order, set_number)"
workout_programs_app,idx_workout_programs_app_active,CREATE INDEX idx_workout_programs_app_active ON public.workout_programs_app USING btree (is_active)
workout_programs_app,idx_workout_programs_app_user_id,CREATE INDEX idx_workout_programs_app_user_id ON public.workout_programs_app USING btree (user_id)
workout_sessions,idx_workout_sessions_email_date,"CREATE INDEX idx_workout_sessions_email_date ON public.workout_sessions USING btree (email, date)"
workout_sessions,idx_workout_sessions_status,"CREATE INDEX idx_workout_sessions_status ON public.workout_sessions USING btree (email, status)"